{
  "ok": true,
  "requestId": "req_help",
  "result": "ChatGPT browser-control SDK commands\n\nworkflow:\n- ask: Ask ChatGPT in a new or selected thread, optionally with files, wait/read, downloads, and reports.\n- askInThread: Open or claim an existing thread by URL, conversation id, title, or search query, then ask and read.\n- askWithFiles: Attach absolute local file paths, optionally set mode, ask, wait, and read.\n- askAndDownload: Ask ChatGPT to produce a visible downloadable output and save the latest exposed file.\n- runMessages: Run sequential prompts where later prompts can use earlier step data.\n- runner.run: Agents-style facade: run a visible ChatGPT browser-control agent against input, files, thread, existing-tab, mode, and response options.\n- responses.create: Narrow Responses-shaped adapter over the visible ChatGPT browser-control runner; rejects unsupported API-only fields before prompt submission.\n- copyLatest: Copy or DOM-read the latest assistant response with Markdown-first fidelity.\n- runPlan: Execute an inline SequencePlan or named macro through the existing sequence engine.\n- new-ask-read: Named macro: open a new thread, ask, wait, and read Markdown.\n- find-open-ask-read: Named macro: search history, open the first match, ask, wait, and read Markdown.\n- find-open-copy-latest: Named macro: search history, open the first match, and copy/read the latest response.\n- attach-ask-read: Named macro: open a new thread, attach files, ask, wait, and read Markdown.\n- ask-and-download: Named macro: ask in a new thread and download the latest file affordance.\n- two-turn: Named macro: run two sequential prompts in a new thread.\ndiagnostic:\n- doctor-upload: Named macro: preflight bridge, login, and upload permission remediation.\n- doctor: Preflight browser bridge, login, upload, existing-tab, artifact, localization, report, and selector readiness.\nreport:\n- redacted-run-report: Named macro: create a redacted report for a supplied CommandResult.\n- createReport: Write a durable redacted run report for a command result.\nprimitive:\n- session.bootstrap: Attach to ChatGPT in Chrome and detect login/blocker state.\n- threads.new: Open a new ChatGPT thread.\n- threads.search: Search visible ChatGPT history by query.\n- threads.open: Open a thread by URL, conversation id, title, or search result.\n- messages.compose: Fill the composer without submitting.\n- messages.submit: Submit the current composer contents.\n- messages.ask: Compose, submit, optionally wait, and optionally read.\n- messages.wait: Wait for the latest assistant response to stabilize.\n- messages.readLatest: Read the latest message as Markdown, normalized text, blocks, or HTML.\n- messages.waitAndRead: Wait for completion and read the latest message.\n- artifacts.listLatest: Detect the latest visible generated ChatGPT artifact, such as an image-only result.\n- artifacts.wait: Wait for a visible generated ChatGPT artifact to appear and stabilize.\n- artifacts.downloadLatest: Download or save the latest visible generated ChatGPT artifact.\n- files.attach: Attach absolute local file paths through visible ChatGPT upload controls.\n- files.downloadLatest: Download the latest visible ChatGPT file affordance.\n- response.copy: Click Copy response and return clipboard Markdown, with DOM fallback.\n- modes.set: Select a visible model or effort candidate when unambiguous.\n- tools.select: Select a visible ChatGPT tool when unambiguous.",
  "schemaVersion": "chatgpt.browser_control.backend_response.v1"
}
